ICD10,Text
X47,случа отравян въздействи газов парообраз веществ
X48,случа отравян въздействи пестицид
X49,случа отравян въздействи неуточн химич отров веществ
X50,пренапряган резк повтар движен
X51,пътешестви преход
X52,продължител престо безтеглов състояни
X53,липс храна
X54,липс вода
X57,лишен неуточн
X58,въздействи уточн фактор
X59,въздействи неуточн фактор
X60,умишлен самоотравян въздействи неопиат аналгети антипирети противоревматич средств
X61,умишлен самоотравян въздействи антиконвулсив седатив сънотвор антипаркинсонов психотроп средств некласифицира другад
X62,умишлен самоотравян въздействи наркоти психодислепти халюциноген некласифицира другад
X63,умишлен самоотравян въздействи лекарств средств влияещ вегетатив нерв систем
X64,умишлен самоотравян въздействи неуточн лекарств средств медикамент биологич веществ
X65,умишлен самоотравян въздействи алкохол
X66,умишлен самоотравян въздействи органич разтворит халогенсъдържа въглеводород пари
X67,умишлен самоотравян въздействи газов парообраз веществ
X68,умишлен самоотравян въздействи пестицид
X69,умишлен самоотравян въздействи неуточн химич отров веществ
X70,умишлен самонараняван обесван удавян удушаван
X71,умишлен самонараняван потъван вода потапян
X72,умишлен самонараняван изстр ръчно огнестрел оръжи
X73,умишлен самонараняван изстр пушк оръжи сачм голямокалибр оръжи
X74,умишлен самонараняван изстр неуточн огнестрел оръжи
X75,умишлен самонараняван използван взривн веществ
X76,умишлен самонараняван дим огън пламъ
X77,умишлен самонараняван пари горещ изпар горещ предме
X78,умишлен самонараняван ост предме
X79,умишлен самонараняван тъпи предме
X80,умишлен самонараняван скачан висок
X81,умишлен самонараняван скачан под движещ обект ляган
X82,умишлен самонараняван авар мотор превоз средств
X83,умишлен самонараняван уточн действи
X84,умишлен самонараняван неуточн действи
X85,нападени прилаган лекарств средств медикамент биологич веществ
X86,нападени прилаган отров веществ
X87,нападени прилаган пестицид
X88,нападени прилаган газов парообраз веществ
X89,нападени прилаган уточн химич отров веществ
X90,нападени прилаган неуточн химич отров веществ
X91,нападени обесван удушаван удавян
X92,нападени потапян потъван вода
X93,нападени изстр ръчно огнестрел оръжи
X94,нападени изстр пушк оръжи сачм голямокалибр огнестрел оръжи
X95,нападени изстр неуточн огнестрел оръжи
X96,нападени използван взривн веществ
X97,нападени прилаган дим огън пламъ
X98,нападени прилаган пара горещ изпар горещ предме
X99,нападени прилаган ост предмет
Y00,нападени прилаган тъп предмет
Y01,нападени блъскан висок
Y02,нападени тласкан под движещ обект слаган жерт
Y03,нападени връхлитан мотор превоз средств
Y04,нападени прилаган физическ сила
Y05,сексуал нападени прилаган физическ сила
Y08,нападени уточн средств
Y09,нападени неуточн средств
Y10,отравян въздействи неопиат аналгети антипирети противоревматич средств неопредел намер
Y11,отравян въздействи антиконвулсив седатив сънотвор антипаркинсонов психотроп средств некласифицира другад неопредел намер
Y12,отравян въздействи наркоти психодислепти халюциноген некласифицира другад неопредел намер
Y13,отравян въздействи лекарств средств влияещ вегетатив нерв систем неопредел намер
Y14,отравян въздействи неуточн лекарств средств медикамент биологич веществ неопредел намер
Y15,отравян въздействи алкохол неопредел намер
Y16,отравян въздействи органич разтворит халогенсъдържа въглеводород пари неопредел намер
Y17,отравян въздействи газов парообраз веществ неопредел намер
Y18,случа отравян въздействи пестицид неопредел намер
Y19,случа отравян въздействи неуточн химич отров веществ неопредел намер
Y20,обесван удушаван удавян неопредел намер
Y21,потъван под вода потапян неопредел намер
Y22,увреждан изстр ръчно огнестрел оръжи неопредел намер
Y23,увреждан изстр пушк оръжи сачм голямокалибр огнестрел оръжи неопредел намер
Y24,увреждан изстр неуточн огнестрел оръжи неопредел намер
Y25,контакт взривн веществ неопредел намер
Y26,въздействи дим огън пламъ неопредел намер
Y27,контакт пара горещ изпар горещ предме неопредел намер
Y28,контакт ост предмет неопредел намер
Y29,контакт тъп предмет неопредел намер
Y30,падан скачан блъскан висок неопредел намер
Y31,падан ляган бяган движещ обект неопредел намер
Y32,удар мотор превоз средств неопредел намер
Y33,уточн уврежда неуточн случа умишлен
Y34,неуточн увреждани неопредел намер
Y64,инфектира медицинск биологич веществ
Y64,инфектира медицинск биологич веществ използва трансфузи инфузи
Y64,инфектира медицинск биологич веществ използва инжекци ваксинаци
Y64,инфектира медицинск биологич веществ прилож начин
Y64,инфектира медицинск биологич веществ прилож неуточн начин
Y66,непредоставян хирургич терапевтич помощ
Y69,злополу време оказван хирургич терапевтич помощ неуточн
Y70,прибор устройств анестези свърза злополук
Y71,прибор устройств диагности лечени болест сърдеч съдов систем свърза злополук
Y72,прибор устройств използва оториноларингологи свърза злополук
Y73,прибор устройств използва гастроентерологи урологи свърза злополук
Y74,прибор устройств общоболнич индивидуал ползван свърза злополук
Y75,прибор устройств използва неврологи свърза злополук
Y76,прибор устройств използва акушерств гинекологи свърза злополук
Y77,прибор устройств използва офталмологи свърза злополук
Y78,радиологич прибор устройств свърза злополук
Y79,ортопедич прибор устройств свърза злополук
Y80,физиотерапевтич прибор устройств свърза злополук
Y81,прибор устройств прилага общ пластич хирурги свърза злополук
Y82,неуточн медицинск прибор устройств свърза злополук
Y85,последи транспорт злополу
Y85,последи злополу свърза мотор превоз средств
Y85,последи злополу свърза неуточн превоз средств
Y86,последи злополук
Y87,последи умишлен самонаранява напад съби уврежда неуточн случа умишлен
Y87,последи умишлен самонараняван
Y87,последи нападени
Y87,последи съби уврежда неуточн случа умишлен
Y88,последи терапевтич хирургич интервенци външ причин заболеваемост смъртност
Y88,последи неблагоприят въздействи лекарств средств медикамент биологич веществ използва терапевтич цели
Y88,последи случа нанес вреда пациент време хирургич терапевтич процедур
Y88,последи злополук свърза използван медицинск оборудван диагностич терапевтич цели
Y88,последи хирургич терапевтич процедур причин анормал реакци късн усложнени пациен споменаван случа нанес вреда време изпълнени
Y89,последи външ причин
Y89,последи резулта закон действи
Y89,последи воен действи
Y89,последи неуточн външ причин
Y91,доказателств влияни алкохол определ степен опияняван
Y91,алкохол интоксикаци лека степен
Y91,алкохол интоксикаци средн степен
Y91,алкохол интоксикаци тежк степен
Y91,алкохол опиянени неуточн
Y95,състояни хоспитализиран
Y96,фактор има отношени работ
Y97,фактор свърза замърсяван окол среда
Y98,фактор свърза начин живот
Z21,безсимптом инфекциоз статус предизвика вирус човешк имунодефицит hiv
Z33,състояни присъщ бременност
G22,паркинсонов синдром ригид тремор форм
O06,аборт компле инкомпле
O05,аборт компле инкомпле криминал
O06,аборт компле инкомпле предизвика
O05,аборт компле инкомпле предизвика немедицинск
G07,абсцес емболич инфекциоз метастатич множеств пиоген септич главен мозъ част гонококов
F88,агнози изображени тяло тактил чуствителност развити
S18,ампутаци травматич пълн частич глава декапитаци ниво шия
R71,анизоцитоз
R92,анормал анормалност диагностич образ гърд
R90,анормал анормалност диагностич образ централ нерв систем
R90,анормал анормалност ехоенцефалограм
R72,анормал анормалност левкоцит клетк диференциаци
R86,анормал анормалност препара мъжк полов орга секрет прост семен течност
R85,анормал анормалност препара храносмилател орга перитонеал течност слюнк
R85,анормал анормалност слюнк
R86,анормал анормалност сперм семен течност
R86,анормал анормалност сперматозоид
R85,анормал анормалност течност перитонеал
R83,анормал анормалност течност цереброспинал
R71,анормал анормалност черв кръвн клетк морфолог обем
T58,асфикси въглерод окис
A64,болест забол венерич
R64,болест забол изтощаван
B89,болест забол паразит
E59,болест продължени keshan
R51,болк глава виж главоболи
R51,болк лице лицев
Z33,бременност единич маточ случа находк
O25,бременност единич маточ усложн недоимъч хранен състоян
O25,бременност единич маточ състоян
A64,бубон подуван лимфни жлези венерич
A64,бубон подуван лимфни жлези ингвинал неспецифич венерич
L62,бухалковид нокът дължа пахидермопериостоз
N63,бучк гърд
N63,възелче възлест гръдн жлеза
S18,декапитаци
L26,дерматит ексфолиатив ексфолиатив генерализира
L26,дерматоз ексфолиатив
E58,дефицит недоимъ дефицит калци диетич
E59,дефицит недоимъ дефицит селен хранител
E60,дефицит недоимъ дефицит цинк хранител
F59,дисфункци психофизиологич
F59,дисфункци физиологич психоген
B09,екзантем екзантем вирус вирус
R15,енкопрез
P77,ентери ост диари епидемич хеморагич предполага инфекциоз произход септич некротизира плода новород
P77,ентероколит некротизира плод новород
L52,еритем erythema еритематоз индуратив нетуберкулоз
R17,жълтениц жълт
F89,забавян забав ретардаци развити развити специфич виж разстройств развити
F73,забавян забав ретардаци умств тежк iq под 20
F78,забавян забав ретардаци умств уточн
R15,загуб контрол сфинктер ректум
R13,затрудн гълтан
R81,захар ури
F73,идиот идиоти вроден
R36,изтичан секрет уретр
R64,изтощаван
R64,изтощени физическ атрофи болест
R17,иктер виж жълтениц
P93,интоксикаци лекарств новород
A89,инфекци инфектира опортюнистич вирус централ нерв систем
J22,инфекци инфектира опортюнистич респиратор тракт долен отдел ост
J22,инфекци инфектира опортюнистич респиратор тракт ост
B89,инфестаци паразит паразит
T58,инхалиран въглерод окис
T58,карбоксихемоглобинем
L86,кератоз дефицит витами
R12,киселин стома вода
B89,кист колоид мукоз ретенцион обикнов паразит
F73,коефициент интелигентност iq под 20
P90,конвулси идиопатич новород
R90,лези поражени нетравматич интракраниал обем
N63,маса гърд
R98,намиран труп неизвест причин смъртта
S16,нараняван мускул сухожили шия ниво
T07,нараняван множеств локализаци
E58,нарушени наруш абсорбци калци
O25,недохранван време бременност раждан пуерпериум
R15,незадържан анал сфинктер
R15,незадържан фекали фекал
M82,остеопороз дължа ендокрин заболяван
M82,остеопороз дължа мултипл миелом 3
R36,отделян пенис
R36,отделян уретр
S18,откъсван травматич глава вътречереп пълн
B89,паразитиз
R13,парали паралитич пълн непъл акт гълтан
L62,пахидермопериостоз бухалковид нокт
R12,пироз
L26,питириазис hebra
J14,пневмони ост двойн мигрира гнойн септич неуточн бронхо бронхиал конфлуира крупоз дифуз дисеминира включва лобов лобар причин haemophilus influenzae
J14,пневмони ост двойн мигрира гнойн септич неуточн лобар причин дисеминира интерстициал haemophilus influenzae
J14,пневмони ост двойн мигрира гнойн септич неуточн дължа haemophilus influenzae h influenzae
J14,пневмони ост двойн мигрира гнойн септич неуточн haemophilus influenzae бронхо лобар
R72,повишаван висок повиш левкоцит
R17,пожълтяван виж жълтениц
R71,пойкилоцитоз
O97,последи акушерск причин
B92,последи болест hansen лепр
T97,последи отравян дължа веществ нелекарств произход
T96,последи отравян дължа лекарств средств медикамент биологич веществ
B91,последи полиомиелит ост
T97,последи токсич ефект веществ нелекарств произход
T96,последи токсич ефект лекарств средств медикамент биологич веществ
B24,придоби имунодефицит синдром спин виж чове вирус имунодефицит hiv болест предизвика
P90,припад новород
R13,проблем свърза гълтан
F69,проблем свърза поведенческ зряла възраст
F24,психоз психотич индуцира
F59,психологич поведенческ фактор влияещ медицинск състояни
F83,развити забав смесен умен
F69,разстройств зряла възраст поведени
F24,разстройств налуд индуцира
F24,разстройств психотич дължа индуцира
F89,разстройств развити
F83,разстройств развити смесен
F88,разстройств развити уточн
P93,реакци медикамент новород
R33,ретенци ретенцион ури
B09,розеол
E59,селенов недоимъ храна
P93,сиво бебе синдром новород
P93,спин заболяван сивот бебе
S87,смазван смаза смачкван коля
S87,смазван смаза смачкван крак подбедриц
S47,смазван смаза смачкван подмишниц
S47,смазван смаза смачкван рамо мишниц
S47,смазван смаза смачкван ръка мишниц рамо
S47,смазван смаза смачкван скапулар област
O97,смърт акушерск неуточн причин годин раждан
O96,смърт акушерск неуточн причин 42 дни годин раждан
R98,смърт свидет неуточн причин
B24,спин свърза комплекс виж болест предизвика вирус човешк имунодефицит hiv
R33,спиран блок ури
B24,сск спин свърза комплекс виж чове болест предизвика имунодефицит вирус hiv
R33,стаза засто ури
Z21,статус пост предизвика вирус човешк имунодефицит hiv безсимптом инфекциоз
F73,субнормалност умств дълбо
T08,счупван фрактур абдукци аддукци изскубван раздроб кост компреси разместван косо сепарира гръбнач прешлен прешлен гръб тяло стълб неврал дъга краче бодилообраз израстъ напре трансверзал израстъ
T10,счупван фрактур абдукци аддукци изскубван раздроб кост компреси разместван косо сепарира крайни горен
T12,счупван фрактур абдукци аддукци изскубван раздроб кост компреси разместван косо сепарира крайни долен
Z33,състояни бремен виж бременност
Z21,тест ване hiv human immunodeficiency virus положител безсимптом
A99,треск хеморагич предава артропод вирус
R13,труден трудност поглъщан виж дисфаг
G01,туберкулоз туберкулар туберкулоз казеоз дегенераци гангр некроз менинг менингит базилар голямомозъч гръбначномозъч гръбнач
R98,умр медицинск наблюдени причин неизвест
R33,ури ретенци стаза задържан
E58,хипокалцием алиментар
T68,хипотерми инцидент дължа
T68,хипотерми инцидент дължа ниск температур окол среда
R51,цефалги виж главоболи
E60,цинк недоимъ храна
B24,чове човешк болест предизвика имунодефицит вирус hiv инфекци
Z21,чове човешк болест предизвика имунодефицит вирус hiv инфекци асимптом състояни
T16,чужд тяло влиза отвор слухов кана
T16,чужд тяло влиза отвор ухо външ
T16,чужд тяло влиза отвор ушн мида
L97,язв разязв улцерира улцераци язв долен крайни атрофич хронич безболезн невроген перфорира пиоген трофич тропическ
L97,язв разязв улцерира улцераци язв долен крайни атрофич хронич безболезн невроген перфорира пиоген трофич тропическ перфорира
L97,язв разязв улцерира улцераци язв кожа атрофич хронич невроген перфорира пиоген трофич долен крайни
L97,язв разязв улцерира улцераци язв пета виж язв долен крайни
F24,folie deux индуцира налуд разстройств
L26,hebra питириазис
Z21,hiv вирус човешк имунодефицит позитив серопозитив
E59,keshan болест
R86,астеносперми
F78,хиперхиломикронем фамил първич
